{"schema_version":"orchestra.cloak-ui-reference-source-record.v1","record_id":"nazia-99.neumorphic-login-form","repository":"Nazia-99/Neumorphic-Login-Form","owner":"Nazia-99","source_revision":"db84757d3c1b16e527f80c41189251ebe73265e2","source_paths_or_artifact_ids":["repository-root@db84757d3c1b16e527f80c41189251ebe73265e2"],"source_category":"UI_REFERENCE","license_identifier":"AMBIGUOUS","license_evidence":[{"type":"REPOSITORY_METADATA","reference":"https://api.github.com/repos/Nazia-99/Neumorphic-Login-Form","source_revision":"db84757d3c1b16e527f80c41189251ebe73265e2","notes":"GitHub repository metadata reported license=null during CUIR-1 inspection while the default branch resolved to this pinned revision. This is not an exhaustive filesystem absence check; direct reuse is not authorized."}],"reuse_classification":"REFERENCE_ONLY","attribution_or_notice_requirements":["Reference attribution must identify Nazia-99 and Nazia-99/Neumorphic-Login-Form.","No direct source-code or asset reuse is authorized by this record."],"pattern_or_asset_summary":"Retained as a concept-level CUIR-1 reference candidate for later static analysis. CUIR-1 does not extract or implement the external pattern.","what_was_learned_or_reused":["Retained repository identity, public visibility, exact revision, and conservative rights classification for later static analysis."],"what_was_not_copied":["No source code, assets, generated output, or external dependencies were copied, installed, or executed during CUIR-1."],"review_owner":"Artificer"}
